{
  "schema_version": "1.0",
  "job_id": "job-full01",
  "trace_id": "flow-a07-001",
  "job_type": "FULL_CHECK",
  "status": "SUCCEEDED",
  "input": {
    "repository": {
      "url": "https://example.com/course/sample-c-project.git",
      "commit": "1111111111111111111111111111111111111111"
    },
    "environment": {
      "image": "example/sample-c-project:gcc-debug",
      "project_root": "/workspace/project"
    },
    "build": {
      "clean_command": "make clean",
      "build_command": "make -j1",
      "verify_command": "make test",
      "timeout_seconds": 600
    },
    "configuration_id": "gcc-debug"
  },
  "output": {
    "finding_count": {
      "missing": 1,
      "redundant": 0
    },
    "artifacts": [
      {
        "artifact_id": "actual-graph-001",
        "type": "ACTUAL_GRAPH",
        "uri": "artifact://A07-B07/job-full01/actual-graph.json",
        "media_type": "application/json",
        "producer_job_id": "job-full01"
      },
      {
        "artifact_id": "report-001",
        "type": "ERROR_REPORT",
        "uri": "artifact://A07-B07/job-full01/error-report.json",
        "media_type": "application/json",
        "producer_job_id": "job-full01"
      }
    ]
  },
  "error": null
}
