{
  "schema_version": "1.0",
  "job_id": "job-incremental01",
  "trace_id": "flow-a07-002",
  "job_type": "INCREMENTAL_CHECK",
  "status": "SUCCEEDED",
  "input": {
    "base_commit": "1111111111111111111111111111111111111111",
    "repository": {
      "url": "https://example.com/course/sample-c-project.git",
      "commit": "2222222222222222222222222222222222222222"
    },
    "environment": {
      "image": "example/sample-c-project:gcc-debug",
      "project_root": "/workspace/project"
    },
    "build": {
      "clean_command": "make clean",
      "build_command": "make -j1",
      "verify_command": "make test",
      "timeout_seconds": 600
    },
    "configuration_id": "gcc-debug",
    "baseline": {
      "commit": "1111111111111111111111111111111111111111",
      "configuration_id": "gcc-debug",
      "actual_graph_uri": "artifact://A07-B07/job-full01/actual-graph.json"
    }
  },
  "output": {
    "finding_count": {
      "current": 1,
      "introduced": 1,
      "resolved": 0
    },
    "artifacts": [
      {
        "artifact_id": "updated-graph-001",
        "type": "ACTUAL_GRAPH",
        "uri": "artifact://A07-B07/job-incremental01/actual-graph.json",
        "media_type": "application/json",
        "producer_job_id": "job-incremental01"
      },
      {
        "artifact_id": "incremental-report-001",
        "type": "ERROR_REPORT",
        "uri": "artifact://A07-B07/job-incremental01/error-report.json",
        "media_type": "application/json",
        "producer_job_id": "job-incremental01"
      }
    ]
  },
  "error": null
}
