{
  "schema_version": "1.0",
  "trace_id": "flow-a07-001",
  "job_type": "FULL_CHECK",
  "input": {
    "repository": {
      "url": "https://example.com/course/sample-c-project.git",
      "commit": "1111111111111111111111111111111111111111"
    },
    "environment": {
      "image": "example/sample-c-project:gcc-debug",
      "project_root": "/workspace/project"
    },
    "build": {
      "clean_command": "make clean",
      "build_command": "make -j1",
      "verify_command": "make test",
      "timeout_seconds": 600
    },
    "configuration_id": "gcc-debug"
  }
}
